<?xml version="1.0" encoding="UTF-8" standalone="no"?>
<pedidos  xmlns:xsi="http://www.w3.org/2001/XMLSchema-instance"
xsi:noNamespaceSchemaLocation="./practica3m.xsd">



    <pedido codigo="Z2345627"  observaciones="urgente" plazo_revision="3-4 dias" >
        
        <trabajador nombre="Jose Luis"/>
       <fecha dia="12" mes="12" anio="1987"/>
        <observaciones tipo="urgente"> Ha ocurrido uin problema </observaciones>
        <articulo cod_articulo="AAA-222">
           <n_unidades >3</n_unidades>
           <precio>66</precio>
           <observaciones>sd</observaciones>
        </articulo>
        <sucursal>
                <direccion> mi casa
                </direccion>
                <direccion_envio> direccion envio 1

                </direccion_envio>
                <direccion_envio>
                direccion envio 2
                </direccion_envio>
            </sucursal>
            <albaran>1233</albaran>

    </pedido>
    <pedido codigo="Z2345632"  observaciones="urgente" plazo_revision="3-4 dias" >
        
            <trabajador nombre="Jose Luis"/>
           <fecha dia="12" mes="12" anio="1987"/>
           
            <articulo cod_articulo="AAH-222">
               <n_unidades >3</n_unidades>
               <precio>66</precio>
               <observaciones></observaciones>
            </articulo>
            <sucursal>
                <direccion> origen
                                </direccion>
                <direccion_envio> direccion envio 1

                </direccion_envio>
                <direccion_envio>
                    envio 2
                </direccion_envio>
            </sucursal>
            <albaran>1233</albaran>



        </pedido>
</pedidos>

